{"type":"config","name":"Qwen3.5-0.8B single-T4 inference throughput","metricName":"output_tok_s","metricUnit":"","bestDirection":"higher"}
{"run":1,"commit":"d6feece","metric":0,"metrics":{"latency_ms":0,"min_tok_s":0,"holdout_tok_s":0,"holdout_latency_ms":0,"completion_tokens":0},"status":"crash","description":"Baseline harness failed because Modal returned an HTTP 303 redirect that the existing benchmark client does not follow","timestamp":1788353489091,"segment":0,"confidence":null,"asi":{"hypothesis":"The existing endpoint benchmark would provide a valid untouched SGLang baseline after redeployment.","rollback_reason":"The benchmark client treats Modal's expected 303 routing redirect as an API failure because curl does not follow redirects.","next_action_hint":"Before the first successful baseline, minimally add curl redirect following to benchmark_endpoint.sh, then freeze the harness."}}
{"run":2,"commit":"d6feece","metric":0,"metrics":{"latency_ms":0,"min_tok_s":0,"holdout_tok_s":0,"holdout_latency_ms":0,"completion_tokens":0},"status":"crash","description":"Baseline rerun followed Modal redirect but the freshly recreated SGLang container returned HTTP 500 during startup","timestamp":1788353579773,"segment":0,"confidence":null,"asi":{"hypothesis":"Following redirects would make the existing benchmark client reach the freshly deployed SGLang server.","rollback_reason":"Redirect handling worked, but the deployment returned HTTP 500 before a valid warmup response; server logs are required.","next_action_hint":"Inspect full experiment and Modal app logs, fix deployment/startup root cause, then rerun baseline."}}
{"run":3,"commit":"8c7e250","metric":96.1,"metrics":{"latency_ms":2664,"min_tok_s":95.66,"holdout_tok_s":77.07,"holdout_latency_ms":1661,"completion_tokens":768},"status":"keep","description":"Established frozen SGLang FP16 single-T4 baseline and fixed Modal redirect handling in the benchmark client","timestamp":1788353690574,"segment":0,"confidence":null,"asi":{"hypothesis":"The untouched SGLang configuration provides a stable baseline once the benchmark follows Modal routing redirects and uses rolling deploys.","engine":"sglang-0.5.18-cu130","workload":"3x256-token primary plus 1x128-token long-prompt holdout","baseline_note":"Primary generated exactly 768 tokens; holdout generated 128, so token-count truncation is stable."}}
{"run":4,"commit":"5f3acc8","metric":97.11,"metrics":{"latency_ms":2636,"min_tok_s":96.96,"holdout_tok_s":77.16,"holdout_latency_ms":1659,"completion_tokens":768},"status":"keep","description":"Run two continuous decode steps per scheduler iteration to reduce host scheduling overhead","timestamp":1788353871778,"segment":0,"confidence":null,"asi":{"hypothesis":"Bundling two decode steps will reduce CPU scheduling and launch overhead on the small 0.8B model.","result":"Primary improved 1.05%; holdout improved slightly; exact output-token counts preserved.","next_action_hint":"Test four continuous decode steps; expected diminishing gains with possible response/TTFT tradeoff."}}
{"run":5,"commit":"65523b0","metric":97.49,"metrics":{"latency_ms":2626,"min_tok_s":97.36,"holdout_tok_s":79.18,"holdout_latency_ms":1617,"completion_tokens":768},"status":"keep","description":"Increase continuous decode grouping from two to four steps","timestamp":1788353907537,"segment":0,"confidence":256.5526315789504,"asi":{"hypothesis":"Four decode steps per scheduler iteration will further amortize host overhead without materially affecting this sequential workload.","result":"Primary gained another 0.39%; holdout gained 2.6%, with token counts unchanged.","next_action_hint":"Test eight steps, then switch optimization axis to CUDA graph batch buckets or attention backend."}}
{"run":6,"commit":"65523b0","metric":97.11,"metrics":{"latency_ms":2636,"min_tok_s":96.66,"holdout_tok_s":78.49,"holdout_latency_ms":1631,"completion_tokens":768},"status":"discard","description":"Increase continuous decode grouping from four to eight steps","timestamp":1788353939946,"segment":0,"confidence":513.1052631579008,"asi":{"hypothesis":"Eight grouped decode steps might further amortize scheduler overhead.","rollback_reason":"Primary throughput regressed 0.39% versus four steps and holdout also regressed.","next_action_hint":"Keep four steps; test decode CUDA graph capture restricted to batch size one to reduce graph dispatch and memory overhead."}}
{"run":7,"commit":"65523b0","metric":96.38,"metrics":{"latency_ms":2656,"min_tok_s":96.15,"holdout_tok_s":78.25,"holdout_latency_ms":1636,"completion_tokens":768},"status":"discard","description":"Use TensorRT-LLM MHA kernels for decode attention inside SGLang","timestamp":1788353978672,"segment":0,"confidence":256.5526315789504,"asi":{"hypothesis":"SGLang's integrated TensorRT-LLM MHA decode backend could outperform FlashInfer on T4.","rollback_reason":"Primary throughput fell 1.14% and holdout fell 1.17%; only six of 24 layers use full attention, so this path is not the dominant win.","next_action_hint":"Test PyTorch sampling or linear-attention backend alternatives; retain FlashInfer full-attention decode."}}
